{
  "$schema": "https://json-schema.org/draft/2020-12/schema",
  "properties": {
    "archived": {
      "type": "boolean"
    },
    "audioSeconds": {
      "anyOf": [
        {
          "type": "number"
        },
        {
          "type": "null"
        }
      ]
    },
    "createdAt": {
      "type": "string"
    },
    "deletedAt": {
      "type": "string"
    },
    "destinationRef": {
      "anyOf": [
        {
          "type": "string"
        },
        {
          "type": "null"
        }
      ]
    },
    "device": {
      "type": "string"
    },
    "done": {
      "type": "boolean"
    },
    "error": {
      "anyOf": [
        {
          "type": "string"
        },
        {
          "type": "null"
        }
      ]
    },
    "failedStep": {
      "anyOf": [
        {
          "enum": [
            "ingest",
            "transcribe",
            "route",
            "act",
            "summarize",
            "notify"
          ],
          "type": "string"
        },
        {
          "type": "null"
        }
      ]
    },
    "favorite": {
      "type": "boolean"
    },
    "id": {
      "type": "string"
    },
    "mode": {
      "enum": [
        "auto",
        "journal",
        "hermes",
        "tab",
        "chat"
      ],
      "type": "string"
    },
    "purgeAt": {
      "type": "string"
    },
    "replyBlocks": {
      "items": {
        "properties": {
          "height": {
            "type": "integer"
          },
          "index": {
            "type": "integer"
          },
          "kind": {
            "const": "mermaid",
            "type": "string"
          },
          "png": {
            "properties": {
              "dark": {
                "type": "string"
              },
              "light": {
                "type": "string"
              }
            },
            "required": [
              "light",
              "dark"
            ],
            "type": "object"
          },
          "svg": {
            "properties": {
              "dark": {
                "type": "string"
              },
              "light": {
                "type": "string"
              }
            },
            "required": [
              "light",
              "dark"
            ],
            "type": "object"
          },
          "width": {
            "type": "integer"
          }
        },
        "required": [
          "index",
          "kind",
          "width",
          "height",
          "svg",
          "png"
        ],
        "type": "object"
      },
      "type": "array"
    },
    "replyText": {
      "anyOf": [
        {
          "type": "string"
        },
        {
          "type": "null"
        }
      ]
    },
    "route": {
      "anyOf": [
        {
          "type": "string"
        },
        {
          "type": "null"
        }
      ]
    },
    "routeReason": {
      "type": "string"
    },
    "routeSuggestion": {
      "type": "string"
    },
    "segmentCount": {
      "type": "integer"
    },
    "startedAt": {
      "type": "string"
    },
    "state": {
      "enum": [
        "receiving",
        "received",
        "transcribed",
        "routed",
        "needs_route",
        "acted",
        "summarized",
        "notified",
        "failed"
      ],
      "type": "string"
    },
    "steps": {
      "items": {
        "properties": {
          "attempts": {
            "minimum": 1,
            "type": "integer"
          },
          "costUsd": {
            "anyOf": [
              {
                "type": "number"
              },
              {
                "type": "null"
              }
            ]
          },
          "error": {
            "anyOf": [
              {
                "type": "string"
              },
              {
                "type": "null"
              }
            ]
          },
          "finishedAt": {
            "anyOf": [
              {
                "type": "string"
              },
              {
                "type": "null"
              }
            ]
          },
          "startedAt": {
            "type": "string"
          },
          "status": {
            "enum": [
              "running",
              "done",
              "failed"
            ],
            "type": "string"
          },
          "step": {
            "enum": [
              "ingest",
              "transcribe",
              "route",
              "act",
              "summarize",
              "notify"
            ],
            "type": "string"
          },
          "usage": {}
        },
        "required": [
          "step",
          "status",
          "startedAt",
          "finishedAt",
          "error",
          "usage",
          "costUsd",
          "attempts"
        ],
        "type": "object"
      },
      "type": "array"
    },
    "summary": {
      "anyOf": [
        {
          "properties": {
            "detail": {
              "type": "string"
            },
            "headline": {
              "type": "string"
            },
            "spoken": {
              "type": "string"
            }
          },
          "required": [
            "headline",
            "detail",
            "spoken"
          ],
          "type": "object"
        },
        {
          "type": "null"
        }
      ]
    },
    "threadId": {
      "type": "string"
    },
    "transcript": {
      "anyOf": [
        {
          "type": "string"
        },
        {
          "type": "null"
        }
      ]
    },
    "typed": {
      "const": true,
      "type": "boolean"
    },
    "updatedAt": {
      "type": "string"
    }
  },
  "required": [
    "id",
    "mode",
    "device",
    "startedAt",
    "state",
    "failedStep",
    "error",
    "segmentCount",
    "audioSeconds",
    "transcript",
    "route",
    "destinationRef",
    "replyText",
    "summary",
    "done",
    "favorite",
    "archived",
    "createdAt",
    "updatedAt",
    "steps"
  ],
  "title": "memos.detail.response",
  "type": "object"
}
