{
  "id": "5c2e9a17-84d3-4b60-a1f7-3e6d0b8c4a91",
  "mode": "hermes",
  "device": "iphone",
  "startedAt": "2026-03-14T09:45:12.000Z",
  "state": "notified",
  "failedStep": null,
  "error": null,
  "segmentCount": 0,
  "audioSeconds": null,
  "transcript": "Remind me to book the dentist for next week.",
  "route": "hermes",
  "destinationRef": "iris-5c2e9a17-84d3-4b60-a1f7-3e6d0b8c4a91",
  "replyText": "Noted. Dentist appointment goes on next week's list.",
  "summary": {
    "headline": "Book the dentist next week",
    "detail": "A reminder to book a dentist appointment for next week is on the list.",
    "spoken": "Dentist booking is on next week's list."
  },
  "typed": true,
  "done": false,
  "favorite": false,
  "archived": false,
  "createdAt": "2026-03-14T09:45:12.204Z",
  "updatedAt": "2026-03-14T09:45:19.870Z",
  "steps": [
    {
      "step": "route",
      "status": "done",
      "startedAt": "2026-03-14T09:45:12.260Z",
      "finishedAt": "2026-03-14T09:45:12.271Z",
      "error": null,
      "usage": null,
      "costUsd": null,
      "attempts": 1
    },
    {
      "step": "act",
      "status": "done",
      "startedAt": "2026-03-14T09:45:12.340Z",
      "finishedAt": "2026-03-14T09:45:16.910Z",
      "error": null,
      "usage": {
        "inputTokens": 420,
        "outputTokens": 64,
        "totalTokens": 484
      },
      "costUsd": 0.0102,
      "attempts": 1
    },
    {
      "step": "summarize",
      "status": "done",
      "startedAt": "2026-03-14T09:45:16.980Z",
      "finishedAt": "2026-03-14T09:45:18.640Z",
      "error": null,
      "usage": {
        "inputTokens": 310,
        "outputTokens": 52,
        "totalTokens": 362
      },
      "costUsd": 0.0011,
      "attempts": 1
    },
    {
      "step": "notify",
      "status": "done",
      "startedAt": "2026-03-14T09:45:18.700Z",
      "finishedAt": "2026-03-14T09:45:19.860Z",
      "error": null,
      "usage": null,
      "costUsd": null,
      "attempts": 1
    }
  ]
}
